### ISSUE TITLE
blobstore excon connection hanging can bring cloudcontroller queue to a halt

### ISSUE THREAD

**Issue by jsievers** [cloudfoundry/cloud_controller_ng#624]
## Issue

Connections to the swift blob store used for pushing droplets can hang forever (probably due to a bug in excon, details see below). If this happens, one of the local worker processes cloud_controller_worker_local_1/2 hangs and no longer takes any work from the queue. As soon as the same  thing happens for the second local worker process, the work queue will grow indefinitely and effectively cf push no longer works (not sure if other cloud controller operations are affected too).

## Context

In the log file cloud_controller_worker_ctl.log we could see, that the worker 2 starts a job

```
[2016-06-16 08:09:11+0000] [Worker(cc_api_worker.api_z1.0.2)] Job VCAP::CloudController::Jobs::ExceptionCatchingJob (id=494436) RUNNING
```

but never completes it. (There is no log line with COMPLETED for worker 2).

```
watch 'netstat -tupen | grep ruby | grep <BLOBSTORE_IP>'
```

shows that the TCP connection hangs forever:

```
tcp        0      0 10.2.1.65:42096         <BLOBSTORE_IP>:443        ESTABLISHED 1000       574371      4069/ruby
```

## Steps to Reproduce

We have seen this issue in production only and it is intermittent. Although intermittent, if you wait for some time both worker processes will hang. We took tcpdump captures and saw that the swift blobstore was sending packets with TCP RST (connection reset) flags. We suppose the connection resets are only happening under load. After that, the connection hangs forever. 
Our current workaround is 'monit restart all' on the api node(s) which will kill the hanging processes and the new ones will resume working on the queue.

sample tcpdump filtered for the hanging connection:

```
12:41:44.412736 IP (tos 0x0, ttl 64, id 61998, offset 0, flags [DF], proto TCP (6), length 60)
    api-z2-0.node.dc1.cf.internal.42096 > <BLOBSTORE_IP>.https: Flags [S], cksum 0xa776 (incorrect -> 0x0187), seq 2455364372, win 29200, options [mss 1460,sackOK,TS val 5050682 ecr 0,nop,wscale 7], length 0
12:41:44.413942 IP (tos 0x0, ttl 242, id 29876, offset 0, flags [DF], proto TCP (6), length 60)
    <BLOBSTORE_IP>.https > api-z2-0.node.dc1.cf.internal.42096: Flags [S.], cksum 0xf735 (correct), seq 2923176425, ack 2455364373, win 4380, options [mss 1460,nop,nop,TS val 1497056476 ecr 5050682,sackOK,eol], length 0
12:41:44.413960 IP (tos 0x0, ttl 64, id 61999, offset 0, flags [DF], proto TCP (6), length 52)
    api-z2-0.node.dc1.cf.internal.42096 > <BLOBSTORE_IP>.https: Flags [.], cksum 0xa76e (incorrect -> 0xc204), ack 1, win 29200, options [nop,nop,TS val 5050682 ecr 1497056476], length 0
--
12:41:44.422848 IP (tos 0x0, ttl 64, id 62000, offset 0, flags [DF], proto TCP (6), length 347)
    api-z2-0.node.dc1.cf.internal.42096 > <BLOBSTORE_IP>.https: Flags [P.], cksum 0xa895 (incorrect -> 0x2ba4), seq 1:296, ack 1, win 29200, options [nop,nop,TS val 5050684 ecr 1497056476], length 295
--
12:41:44.426239 IP (tos 0x0, ttl 242, id 29954, offset 0, flags [DF], proto TCP (6), length 52)
    <BLOBSTORE_IP>.https > api-z2-0.node.dc1.cf.internal.42096: Flags [.], cksum 0x20a0 (correct), ack 296, win 4675, options [nop,nop,TS val 1497056485 ecr 5050684], length 0
--
12:41:44.427954 IP (tos 0x0, ttl 242, id 29977, offset 0, flags [DF], proto TCP (6), length 2948)
    <BLOBSTORE_IP>.https > api-z2-0.node.dc1.cf.internal.42096: Flags [.], cksum 0xb2be (incorrect -> 0x24eb), seq 1:2897, ack 296, win 4675, options [nop,nop,TS val 1497056487 ecr 5050684], length 2896
12:41:44.427970 IP (tos 0x0, ttl 64, id 62001, offset 0, flags [DF], proto TCP (6), length 52)
    api-z2-0.node.dc1.cf.internal.42096 > <BLOBSTORE_IP>.https: Flags [.], cksum 0xa76e (incorrect -> 0x9fce), ack 2897, win 34752, options [nop,nop,TS val 5050686 ecr 1497056487], length 0
--
12:41:54.415658 IP (tos 0x0, ttl 242, id 34858, offset 0, flags [DF], proto TCP (6), length 40)
    <BLOBSTORE_IP>.https > api-z2-0.node.dc1.cf.internal.42096: Flags [R.], cksum 0xfb26 (correct), seq 3639, ack 296, win 4675, length 0
12:41:54.415692 IP (tos 0x0, ttl 64, id 62002, offset 0, flags [DF], proto TCP (6), length 52)
    api-z2-0.node.dc1.cf.internal.42096 > <BLOBSTORE_IP>.https: Flags [.], cksum 0xa76e (incorrect -> 0x960d), ack 2897, win 34752, options [nop,nop,TS val 5053183 ecr 1497056487], length 0
```

you can see the RST packet being sent at 12:41:54.415658

## Expected result

Even if there is a TCP connection reset from the blobstore, this must not bring the cloud controller queue as a whole to a halt. There should be a timeout on the client and the work queue must continue to be worked on.

## Current result

both cloud_controller_worker_local_1/2 processes hang forever with a TCP connection to the blobstore open. The cloud controller work queue keeps piling up. 'cf push' no longer possible.

## Possible Fix

we suspect that excon issue https://github.com/excon/excon/issues/542 is causing this.

cloud controller currently uses excon 0.48.0 
https://github.com/cloudfoundry/cloud_controller_ng/blob/master/Gemfile.lock#L114

and this issue is fixed in excon 0.49.0. Upgrading excon (and possibly fog) could help.

Maybe there are also other ways to make cloud_controller more resilient to hanging worker processes.

**Comment by jsievers** [comment]
it looks like bosh runs into the same excon problem, see https://github.com/cloudfoundry/bosh/issues/1234

**Comment by adowns01** [comment]
Hello @jsievers, 

We updated fog to 1.38.0 and excon to 0.51.0 in this commit: 94142a255466f1b3571399beba466caf435bd215

We're hoping that this stops the workers from hanging. These changes will be in the next cf-release. Please let us know if it fixes the issues you are seeing. 

If you feel that your issue has been resolved, please go ahead and close it. 

Thanks,
@adowns01 & @youreddy

**Comment by jsievers** [comment]
Thanks for the update!

It will take us some time to get the new CF 240 release into production and see if the intermittent problem (which we only see in production) no longer occurs.

That said I am going to assume it's fixed now and re-open just in case we still see the problem.
