### ISSUE TITLE
Cloud Controller sends thousands of nats messages per second when db connection fails

### ISSUE THREAD

**Issue by frodenas** [cloudfoundry/cloud_controller_ng#726]
## Issue

When the cloud controller loses the connection to the database, the cloud controller process starts emitting thousands of nats messages per second.

## Context

The platform operator started the upgrade process of a single node PostgreSQL server that contains the `ccdb` and `uaadb`. A few seconds after stopping the PostgreSQL server, the network became unresponsive and it went down. Checking the firewalls logs we saw an unusually high traffic from the `cloud controller` vm to the `nats` vm on port `4222`.

CF-Release was [v245](https://github.com/cloudfoundry/cf-release/releases/tag/v245). CAPI-Release was [v1.7.0](https://github.com/cloudfoundry/capi-release/releases/tag/1.7.0). Stemcell was `3262.8`.

## Steps to Reproduce

This can be reproduced easily on any CF deployment, for example using [PCF Dev](https://pivotal.io/pcf-dev):

1. SSH into PCF-Dev using the `vagrant` user and become `root`;
2. Run the command `tcpdump -i any dst port 4222` to monitor all traffic on nats port `4222`. After a few seconds you will see some traffic;
3. SSH into PCF-Dev on a different terminal windows and become `root`;
4. Stop MySQL by running `monit stop mariadb_ctrl`;
5. Go back to the 1st terminal window, wait a few seconds, and observe how the nats traffic is unusually high, emitting thousands of messages per second.

## Expected result

Cloud Controller should emit some nats messages, but **NOT** thousands of them.

## Current result

Thousands of nats messages per second were emitted. An example of the `tcpdump` output:

```
16:40:12.614410 IP pcfdev-0.node.dc1.cf.internal.59157 > pcfdev-0.node.dc1.cf.internal.4222: Flags [S], seq 2668716949, win 43690, options [mss 65495,sackOK,TS val 1012619 ecr 0,nop,wscale 7], length 0
16:40:12.614428 IP pcfdev-0.node.dc1.cf.internal.59148 > pcfdev-0.node.dc1.cf.internal.4222: Flags [R], seq 163609096, win 0, length 0
16:40:12.614430 IP pcfdev-0.node.dc1.cf.internal.59157 > pcfdev-0.node.dc1.cf.internal.4222: Flags [.], ack 296979670, win 342, options [nop,nop,TS val 1012619 ecr 1012619], length 0
16:40:12.614472 IP pcfdev-0.node.dc1.cf.internal.59156 > pcfdev-0.node.dc1.cf.internal.4222: Flags [F.], seq 199622405, ack 199622468, win 342, options [nop,nop,TS val 1012619 ecr 1012619], length 0
16:40:12.614497 IP pcfdev-0.node.dc1.cf.internal.59149 > pcfdev-0.node.dc1.cf.internal.4222: Flags [R], seq 3829098956, win 0, length 0
16:40:12.614508 IP pcfdev-0.node.dc1.cf.internal.59158 > pcfdev-0.node.dc1.cf.internal.4222: Flags [S], seq 1822773947, win 43690, options [mss 65495,sackOK,TS val 1012619 ecr 0,nop,wscale 7], length 0
16:40:12.614527 IP pcfdev-0.node.dc1.cf.internal.59158 > pcfdev-0.node.dc1.cf.internal.4222: Flags [.], ack 199620560, win 342, options [nop,nop,TS val 1012619 ecr 1012619], length 0
16:40:12.614536 IP pcfdev-0.node.dc1.cf.internal.59150 > pcfdev-0.node.dc1.cf.internal.4222: Flags [R], seq 1697843514, win 0, length 0
```
I got around **40k** nats messages per second just trying to reproduce this issue on my PCF-Dev test environment!

## Possible Fix

We have not yet found the root cause, but we found a workaround that worked for us. We manually modified the [cf-message-bus](https://github.com/cloudfoundry/cf-message-bus) gem at the cloud controller vm to set the nats [max_reconnect_attempts](https://github.com/cloudfoundry/cf-message-bus/blob/master/lib/cf_message_bus/message_bus_factory.rb#L8) configuration option to `10` instead of an `infinite` number of reconnections.

**Comment by zrob** [comment]
Hi @frodenas 

This issue was actually a symptom of issue #737.
Now that #737 has been fixed we are no longer seeing this problem.

We're going to close this issue as resolved but if you see it again after this gets into cf-release please re-open.

thanks,
@zrob & @ericpromislow
